operator	n. 操作员, 行家, 经纪人, 算子, 运算符	[ˈɒpəreɪtə(r)]	A bade guard is fitted to protect the operator.	 为保证操作人员的人身安全安装了桨叶保护罩。	He's something of a smooth operator.	 以说，他是一个八面玲珑的滑头。

typist	n. 打字员	[ˈtaɪpɪst]	I was deemed to be a competent shorthand typist.	 我被视为是一名能干的速记打字员。	He has done many jobs: typist, salesman, deliverer and so forth.	 他干过很多种工作：打字员、推销员、投递员等。

correspondent	n. 通讯记者, 通信者
	[ˌkɒrəˈspɒndənt]	With more details, here's our foreign affairs correspondent.	详细情况，请听我们外交事务记者的报道。	Our economics correspondent, James Morgan, is just back from Germany 	我们的财经记者詹姆斯·摩根刚刚从德国回来。

journalist	n. 新闻记者, 从事新闻杂志业的人	[ˈdʒɜːnəlɪst]	His sister is a journalist.	他的姐姐是位新闻工作者。	The main character is a journalist in flight from a failed marriage.	 主角是一个逃避失败婚姻的记者。

dentist	n. 牙科医生
	[ˈdentɪst],	The dentist may decide that the wisdom teeth need to be extracted.	 牙医可能会认为智齿需要拔掉。	I have to go to the dentist tomorrow.	我明天得去看牙医。

editor	n. 编者, 编辑, 主笔, 编辑器, 编辑装置
	[ˈedɪtə(r)]	The editor welcomes correspondence from readers on any subject.	 编辑欢迎读者有关任何问题的来信。	He has no plans to retire as editor of the magazine.	 他还不打算从杂志编辑的位子上退休。

librarian	n. 图书馆员, 图书管理员
	[laɪˈbreəriən]	The librarian entered a new book in the catalogue.	 图书管理员把一本新书编入目录。	The students put the books on the library desk, and the librarian checked them in.	 学生们把书放在图书馆的柜台上，管理员查核后收回。

fireman	n. 救火队员, 消防队员
	[ˈfaɪəmən]	Fireman battled through the smoke in a doomed attempt to rescue the children.	消防队员奋力穿过烟雾企图去救孩子们，而这注定是要失败的。	A fireman was overcome by smoke and fumes.	 一名消防队员被浓烟熏倒。

freelance	n. 自由作家, 自由投稿, 自由职业者
a. 自由投稿的	[ˈfriːlɑːns]	His freelance work brings him in about$ 20 000 a year.	 他做自由职业每年可赚2万元。	After leaving college, he set himself up as a freelance photographer.	 大学毕业后，他干起了特约摄影师。

accomplish	vt. 完成, 达到, 实现, 使完美	[əˈkʌmplɪʃ]	The first part of the plan has been safely accomplished.	 计划的第一部分已顺利完成。	The task was accomplished with comparative ease.	 相对而言，任务完成得比较轻松。

achieve	vt. 完成, 达到
vi. 如愿以偿	[əˈtʃiːv]	The college's aim is to help students achieve their aspirations.	 大学的目标是帮助学生实现他们的抱负。	She never achieved her ambition of becoming a famous writer.	 她一直未能实现当名作家的夙愿.

attain	vt. 达到, 获得
vi. 达到	[əˈteɪn]	He attained a good mark in the examination.	 他在考试中得到好分数。	Most of our students attained five 'A' grades in their exams.	 我们多数学生的考试成绩是五个优。

fulfil	vt. 实践, 履行, 实行, 完成, 结束, 满足	[fʊlˈfɪl]	Without them you will not be able to fulfil the tasks you have before you	 没有他们你将无法完成面临的任务。	He departed this world with a sense of having fulfilled his destiny.	 他带着一种已完成使命的满足感离开了这个世界。

deadline	n. 最后期限, 截止期限
	[ˈdedlaɪn]	I finished several days ahead of the deadline.	 我是在最后期限的前几天完成的。	This deadline will be extended only in exceptional circumstances.	 只有在特殊情况下才会延长最后期限。


